,UF,Instituição de Ensino,Contagem,Proporção
0,ES,Universidade Federal do Espírito Santo,71,4.4%
1,RJ,Universidade do Estado do Rio de Janeiro,66,4.09%
2,PE,Universidade Federal do Vale do São Francisco,61,3.78%
3,SP,Universidade Estadual de Campinas,58,3.6%
4,SP,Universidade Federal do ABC,58,3.6%
5,PR,Universidade Estadual de Londrina,52,3.22%
6,RS,Universidade Federal do Rio Grande do Sul,46,2.85%
7,PR,Universidade Estadual do Oeste do Paraná,42,2.6%
8,RJ,Universidade Estadual do Norte Fluminense,42,2.6%
9,PE,Universidade Federal Rural de Pernambuco,40,2.48%
10,CE,Universidade Estadual do Ceará,39,2.42%
11,BA,Universidade Estadual de Santa Cruz,38,2.36%
12,MT,Universidade do Estado de Mato Grosso,36,2.23%
13,RS,Universidade Federal de Pelotas,35,2.17%
14,BA,Universidade Federal do Sul da Bahia,35,2.17%
15,BA,Universidade Estadual de Feira de Santana,32,1.98%
16,AM,Universidade Federal do Amazonas,32,1.98%
17,RJ,Universidade Federal do Rio de Janeiro,29,1.8%
18,PI,Universidade Federal do Piauí,29,1.8%
19,MA,Universidade Federal do Maranhão,28,1.74%
20,PR,Universidade Estadual de Maringá,28,1.74%
21,MT,Universidade Federal do Mato Grosso,26,1.61%
22,RO,Universidade Federal de Rondônia,26,1.61%
23,MG,Centro Federal de Educação Tecnológica de Minas Gerais,25,1.55%
24,DF,Universidade de Brasília,25,1.55%
25,MG,Universidade Federal de Viçosa,24,1.49%
26,AL,Universidade Federal de Alagoas,24,1.49%
27,PA,Universidade do Estado do Pará,23,1.43%
28,PR,Universidade Tecnológica Federal do Paraná,23,1.43%
29,PR,Universidade Estadual do Paraná,23,1.43%
30,BA,Universidade do Estado da Bahia,22,1.36%
31,RJ,Fundação de Apoio à Escola Técnica do Estado do Rio de Janeiro,20,1.24%
32,CE,Universidade Federal do Ceará,19,1.18%
33,SC,Universidade do Estado de Santa Catarina,19,1.18%
34,PR,Universidade Estadual de Ponta Grossa,16,0.99%
35,AC,Universidade Federal do Acre,16,0.99%
36,RJ,Centro Federal de Educação Tecnológica Celso Suckow da Fonseca,16,0.99%
37,MG,Universidade Federal de Uberlândia,15,0.93%
38,MG,Universidade Federal de Lavras,15,0.93%
39,MT,Universidade Federal de Rondonópolis,15,0.93%
40,CE,Universidade Regional do Cariri,14,0.87%
41,SP,Universidade de São Paulo,14,0.87%
42,PA,Universidade Federal do Oeste do Pará,13,0.81%
43,PR,Universidade Federal do Paraná,13,0.81%
44,PE,Universidade de Pernambuco,13,0.81%
45,SE,Universidade Federal de Sergipe,13,0.81%
46,RJ,Universidade Federal Fluminense,11,0.68%
47,PI,Universidade Estadual do Piauí,10,0.62%
48,SP,Universidade Federal de São Carlos,10,0.62%
49,DF,Universidade do Distrito Federal,10,0.62%
50,BA,Universidade Estadual do Sudoeste da Bahia,10,0.62%
51,AP,Universidade Federal do Amapá,10,0.62%
52,RR,Universidade Federal de Roraima,10,0.62%
53,MS,Universidade Estadual de Mato Grosso do Sul,9,0.56%
54,PR,Universidade Estadual do Norte do Paraná,8,0.5%
55,MS,Universidade Federal de Dourados,8,0.5%
56,PB,Universidade Federal da Paraíba,8,0.5%
57,PA,Universidade Federal do Pará,7,0.43%
58,PA,Universidade Federal Rural da Amazônia,7,0.43%
59,PR,Universidade Federal da Integração Latino-Americana,7,0.43%
60,PB,Universidade Estadual da Paraíba,6,0.37%
61,PR,Universidade Estadual do Centro-Oeste,5,0.31%
62,BA,Universidade Federal do Recôncavo da Bahia,5,0.31%
63,RN,Universidade Federal do Rio Grande do Norte,5,0.31%
64,SC,Universidade Federal da Fronteira Sul,5,0.31%
65,PE,Universidade Federal de Pernambuco,5,0.31%
66,MG,Universidade Federal dos Vales do Jequitinhonha e Mucuri,5,0.31%
67,RS,Instituto Federal do Rio Grande do Sul,5,0.31%
68,RS,"Instituto Federal de Educação, Ciência e Tecnologia do Rio Grande do Sul",5,0.31%
69,RS,Universidade Federal de Rio Grande,4,0.25%
70,MG,Universidade Federal de São João del Rei,4,0.25%
71,MG,Universidade Federal de Ouro Preto,4,0.25%
72,RS,Universidade Federal de Santa Maria,4,0.25%
73,RR,Universidade Estadual de Roraima,4,0.25%
74,GO,Universidade Estadual de Goiás,4,0.25%
75,MG,Universidade Federal de Juiz de Fora,3,0.19%
76,RJ,Universidade do Rio de Janeiro,2,0.12%
77,SP,Universidade Federal de São Paulo,2,0.12%
78,AC,Colégio de Aplicação da Universidade Federal do Acre,2,0.12%
79,PE,Universidade Federal do Agreste de Pernambuco,2,0.12%
80,TO,Universidade de Guripi,2,0.12%
81,PR,Instituto Federal do Paraná,2,0.12%
82,GO,Instituto Federal de Goiás,2,0.12%
83,MG,Universidade do Estado de Minas Gerais,2,0.12%
84,PA,Universidade Federal do Sul e Sudeste do Pará,2,0.12%
85,PI,Universidade Federal do Delta do Parnaíba,2,0.12%
86,PB,Universidade Federal de Campina Grande,2,0.12%
87,BA,Universidade Federal da Bahia,2,0.12%
88,BA,Universidade Federal do Oeste da Bahia,1,0.06%
89,MA,Universidade Estadual do Maranhão,1,0.06%
90,SP,Universidade Nove de Julho,1,0.06%
91,CE,Universidade da Integração Internacional da Lusofonia Afro-Brasileira,1,0.06%
92,ES,Associação Brasileira de Odontologia do Espírito Santo,1,0.06%
93,TO,Universidade Federal do Norte de Tocantins,1,0.06%
94,SP,Rede Municipal de Diadema,1,0.06%
95,SP,Faculdade de Medicina de Jundiaí,1,0.06%
96,MA,Universidade Estadual da Região Tocantina do Maranhão,1,0.06%
97,RJ,Universidade Federal do Estado do Rio de Janeiro,1,0.06%
98,MG,Instituto Federal do Sudeste Mineiro,1,0.06%
99,RS,Universidade de Santa Cruz do Sul,1,0.06%
100,RJ,Secretaria de Estado de Educação do Rio de Janeiro,1,0.06%
101,RS,Universidade Federal do Pampa,1,0.06%
102,MG,Universidade Federal de Itajubá,1,0.06%
103,MG,Universidade Federal do Triângulo Mineiro,1,0.06%
104,PA,Instituto Federal do Pará Campus Castanhal,1,0.06%
105,RO,Instituto Federal de Rondônia,1,0.06%
106,RJ,Colégio de Aplicação da Universidade do Estado do Rio de Janeiro,1,0.06%
107,RN,Universidade Federal Rural do Semi-Árido,1,0.06%
108,RJ,Fundação Centro de Ciências e Educação Superior a Distância do Estado do Rio de Janeiro,1,0.06%
109,MG,Universidade Estadual de Montes Claros,1,0.06%
